{
  "schema": "uniad.c/result-v1",
  "profile": "tiny-synthetic-v1",
  "scene": "synthetic-scene-001",
  "frame_index": 1,
  "coordinate_frame": "ego",
  "units": {
    "distance": "meter",
    "time": "step"
  },
  "command": "left",
  "tracks": [
    {
      "id": 5,
      "x": 1.5,
      "y": -3.5,
      "score": 0.5067716836929321
    },
    {
      "id": 6,
      "x": 2.5,
      "y": -3.5,
      "score": 0.5066651105880737
    },
    {
      "id": 7,
      "x": 3.5,
      "y": -3.5,
      "score": 0.5060809850692749
    },
    {
      "id": 20,
      "x": 0.5,
      "y": -1.5,
      "score": 0.5056645274162292
    },
    {
      "id": 4,
      "x": 0.5,
      "y": -3.5,
      "score": 0.5053765773773193
    },
    {
      "id": 19,
      "x": -0.5,
      "y": -1.5,
      "score": 0.5051601529121399
    },
    {
      "id": 21,
      "x": 1.5,
      "y": -1.5,
      "score": 0.5050983428955078
    },
    {
      "id": 18,
      "x": -1.5,
      "y": -1.5,
      "score": 0.5036562085151672
    }
  ],
  "map": [
    {
      "points": [
        [
          -4.0,
          -3.0
        ],
        [
          4.0,
          -3.0
        ]
      ],
      "score": 0.5053765773773193
    },
    {
      "points": [
        [
          -4.0,
          -1.0
        ],
        [
          4.0,
          -1.0
        ]
      ],
      "score": 0.49552857875823975
    },
    {
      "points": [
        [
          -4.0,
          1.0
        ],
        [
          4.0,
          1.0
        ]
      ],
      "score": 0.5056645274162292
    },
    {
      "points": [
        [
          -4.0,
          3.0
        ],
        [
          4.0,
          3.0
        ]
      ],
      "score": 0.49817201495170593
    }
  ],
  "motion": [
    {
      "track_id": 5,
      "modes": [
        {
          "score": 0.5253385841846466,
          "trajectory": [
            [
              1.65,
              -3.38
            ],
            [
              1.8,
              -3.26
            ],
            [
              1.95,
              -3.14
            ],
            [
              2.1,
              -3.02
            ]
          ]
        },
        {
          "score": 0.42533858418464665,
          "trajectory": [
            [
              1.7,
              -3.34
            ],
            [
              1.9,
              -3.18
            ],
            [
              2.1,
              -3.02
            ],
            [
              2.3,
              -2.86
            ]
          ]
        },
        {
          "score": 0.3253385841846466,
          "trajectory": [
            [
              1.75,
              -3.3
            ],
            [
              2.0,
              -3.1
            ],
            [
              2.25,
              -2.9
            ],
            [
              2.5,
              -2.7
            ]
          ]
        }
      ]
    },
    {
      "track_id": 6,
      "modes": [
        {
          "score": 0.5253332555294037,
          "trajectory": [
            [
              2.35,
              -3.38
            ],
            [
              2.2,
              -3.26
            ],
            [
              2.05,
              -3.14
            ],
            [
              1.9,
              -3.02
            ]
          ]
        },
        {
          "score": 0.4253332555294037,
          "trajectory": [
            [
              2.3,
              -3.34
            ],
            [
              2.1,
              -3.18
            ],
            [
              1.9,
              -3.02
            ],
            [
              1.7,
              -2.86
            ]
          ]
        },
        {
          "score": 0.3253332555294037,
          "trajectory": [
            [
              2.25,
              -3.3
            ],
            [
              2.0,
              -3.1
            ],
            [
              1.75,
              -2.9
            ],
            [
              1.5,
              -2.7
            ]
          ]
        }
      ]
    },
    {
      "track_id": 7,
      "modes": [
        {
          "score": 0.5253040492534637,
          "trajectory": [
            [
              3.5,
              -3.38
            ],
            [
              3.5,
              -3.26
            ],
            [
              3.5,
              -3.14
            ],
            [
              3.5,
              -3.02
            ]
          ]
        },
        {
          "score": 0.42530404925346377,
          "trajectory": [
            [
              3.5,
              -3.34
            ],
            [
              3.5,
              -3.18
            ],
            [
              3.5,
              -3.02
            ],
            [
              3.5,
              -2.86
            ]
          ]
        },
        {
          "score": 0.32530404925346373,
          "trajectory": [
            [
              3.5,
              -3.3
            ],
            [
              3.5,
              -3.1
            ],
            [
              3.5,
              -2.9
            ],
            [
              3.5,
              -2.7
            ]
          ]
        }
      ]
    },
    {
      "track_id": 20,
      "modes": [
        {
          "score": 0.5252832263708115,
          "trajectory": [
            [
              0.65,
              -1.38
            ],
            [
              0.8,
              -1.26
            ],
            [
              0.95,
              -1.1400000000000001
            ],
            [
              1.1,
              -1.02
            ]
          ]
        },
        {
          "score": 0.4252832263708115,
          "trajectory": [
            [
              0.7,
              -1.34
            ],
            [
              0.9,
              -1.18
            ],
            [
              1.1,
              -1.02
            ],
            [
              1.3,
              -0.86
            ]
          ]
        },
        {
          "score": 0.3252832263708115,
          "trajectory": [
            [
              0.75,
              -1.3
            ],
            [
              1.0,
              -1.1
            ],
            [
              1.25,
              -0.8999999999999999
            ],
            [
              1.5,
              -0.7
            ]
          ]
        }
      ]
    },
    {
      "track_id": 4,
      "modes": [
        {
          "score": 0.525268828868866,
          "trajectory": [
            [
              0.5,
              -3.38
            ],
            [
              0.5,
              -3.26
            ],
            [
              0.5,
              -3.14
            ],
            [
              0.5,
              -3.02
            ]
          ]
        },
        {
          "score": 0.42526882886886597,
          "trajectory": [
            [
              0.5,
              -3.34
            ],
            [
              0.5,
              -3.18
            ],
            [
              0.5,
              -3.02
            ],
            [
              0.5,
              -2.86
            ]
          ]
        },
        {
          "score": 0.32526882886886593,
          "trajectory": [
            [
              0.5,
              -3.3
            ],
            [
              0.5,
              -3.1
            ],
            [
              0.5,
              -2.9
            ],
            [
              0.5,
              -2.7
            ]
          ]
        }
      ]
    },
    {
      "track_id": 19,
      "modes": [
        {
          "score": 0.525258007645607,
          "trajectory": [
            [
              -0.5,
              -1.38
            ],
            [
              -0.5,
              -1.26
            ],
            [
              -0.5,
              -1.1400000000000001
            ],
            [
              -0.5,
              -1.02
            ]
          ]
        },
        {
          "score": 0.425258007645607,
          "trajectory": [
            [
              -0.5,
              -1.34
            ],
            [
              -0.5,
              -1.18
            ],
            [
              -0.5,
              -1.02
            ],
            [
              -0.5,
              -0.86
            ]
          ]
        },
        {
          "score": 0.325258007645607,
          "trajectory": [
            [
              -0.5,
              -1.3
            ],
            [
              -0.5,
              -1.1
            ],
            [
              -0.5,
              -0.8999999999999999
            ],
            [
              -0.5,
              -0.7
            ]
          ]
        }
      ]
    },
    {
      "track_id": 21,
      "modes": [
        {
          "score": 0.5252549171447753,
          "trajectory": [
            [
              1.35,
              -1.38
            ],
            [
              1.2,
              -1.26
            ],
            [
              1.05,
              -1.1400000000000001
            ],
            [
              0.9,
              -1.02
            ]
          ]
        },
        {
          "score": 0.4252549171447754,
          "trajectory": [
            [
              1.3,
              -1.34
            ],
            [
              1.1,
              -1.18
            ],
            [
              0.8999999999999999,
              -1.02
            ],
            [
              0.7,
              -0.86
            ]
          ]
        },
        {
          "score": 0.3252549171447754,
          "trajectory": [
            [
              1.25,
              -1.3
            ],
            [
              1.0,
              -1.1
            ],
            [
              0.75,
              -0.8999999999999999
            ],
            [
              0.5,
              -0.7
            ]
          ]
        }